{
  "$schema": "https://json-schema.org/draft/2020-12/schema",
  "$id": "https://bio-apple.github.io/ai/schemas/agent-hub.schema.json",
  "title": "AgentHub",
  "type": "object",
  "required": ["title", "categories"],
  "additionalProperties": true,
  "properties": {
    "title": { "type": "string", "minLength": 1 },
    "lead": { "type": "string" },
    "updated_at": { "type": "string" },
    "categories": {
      "type": "array",
      "minItems": 1,
      "items": {
        "type": "object",
        "required": ["id", "label", "items"],
        "additionalProperties": true,
        "properties": {
          "id": { "type": "string", "minLength": 1 },
          "label": { "type": "string", "minLength": 1 },
          "blurb": { "type": "string" },
          "items": {
            "type": "array",
            "minItems": 1,
            "items": {
              "type": "object",
              "required": ["id", "name", "summary", "href"],
              "additionalProperties": true,
              "properties": {
                "id": { "type": "string", "minLength": 1 },
                "name": { "type": "string", "minLength": 1 },
                "tagline": { "type": "string" },
                "summary": { "type": "string", "minLength": 1 },
                "href": { "type": "string", "minLength": 1 },
                "tags": {
                  "type": "array",
                  "items": { "type": "string" }
                }
              }
            }
          }
        }
      }
    }
  }
}
